{
  "schema_version": "1",
  "operator_id": "operator-b-test",
  "certification_level": 2,
  "protocol_version": "1.0",
  "capabilities": [],
  "public_key": "ed25519:AAAAAAAAAAAAAAAAAAAAAAAAAAAAAAAAAAAAAAAAAAA",
  "issued_at": "2026-05-30T00:00:00Z",
  "expires_at": "2026-08-27T00:00:00Z",
  "issuer": "BANZA",
  "issuer_key_id": "test-banza-key-2026-05",
  "signature": "AAAAAAAAAAAAAAAAAAAAAAAAAAAAAAAAAAAAAAAAAAAAAAAAAAAAAAAAAAAAAAAAAAAAAAAAAAAAAAAAAAAAAA"
}
