{
  "schema_version": "1",
  "operator_id": "some-other-operator",
  "certification_level": 3,
  "protocol_version": "1.0",
  "capabilities": ["cross_operator_routing"],
  "public_key": "ed25519:AAAAAAAAAAAAAAAAAAAAAAAAAAAAAAAAAAAAAAAAAAA",
  "issued_at": "2026-05-30T00:00:00Z",
  "expires_at": "2026-08-27T00:00:00Z",
  "issuer": "BANZA",
  "issuer_key_id": "test-banza-key-2026-05",
  "signature": "AAAAAAAAAAAAAAAAAAAAAAAAAAAAAAAAAAAAAAAAAAAAAAAAAAAAAAAAAAAAAAAAAAAAAAAAAAAAAAAAAAAAAA"
}
